{
  "protocol_version": 1,
  "receipt_id": "routine-receipt-funnel-001",
  "run_id": "routine-run-funnel-001",
  "routine_ref": "routine:funil-diario-cerebro:1.0.0",
  "routine_id": "funil-diario-cerebro",
  "routine_version": "1.0.0",
  "system_ref": "analisar-funil",
  "binding_ref": "executor-codex-local",
  "adapter": "codex-cli",
  "requested_model": "gpt-5.6-sol",
  "model_observation": "requested-not-verified",
  "trigger": "manual",
  "slot_key": "slot-funnel-manual-001",
  "scheduled_for": null,
  "attempts": 1,
  "status": "completed",
  "reason_code": "executor-completed",
  "started_at": "2026-08-23T22:21:00.000Z",
  "completed_at": "2026-08-23T22:21:30.000Z",
  "input_refs": [
    "operacao/rotinas/funil-diario.prompt.md",
    "source:paid-media"
  ],
  "output_ref": "operacao/execucoes/rotinas/funil-diario.md",
  "access_receipt_refs": ["access-receipt:access-funnel-001"],
  "content_shared_with_provider": true,
  "privacy": {
    "content_shared_with_inevita": false,
    "prompt_recorded": false,
    "output_recorded": false,
    "raw_error_recorded": false
  }
}
